{
  "id": "web-foundations",
  "title": "Web Foundations Roadmap",
  "version": "0.2.0",
  "description": "Pilot roadmap connecting Git & GitHub with HTML fundamentals.",
  "entryNodeIds": [
    "git.what-is-git",
    "html.what-html-does"
  ],
  "nodes": [
    {
      "id": "git.what-is-git",
      "track": "git-github",
      "type": "topic",
      "title": "What is Git?",
      "level": "root",
      "status": "pilot",
      "x": 120,
      "y": 120,
      "contentRef": "content/topics/git-github/what-is-git.md",
      "estimatedMinutes": 20,
      "tags": ["git", "version-control"]
    },
    {
      "id": "git.first-local-repo",
      "track": "git-github",
      "type": "practice",
      "title": "First Local Repo",
      "level": "practice",
      "status": "pilot",
      "x": 420,
      "y": 120,
      "contentRef": "content/practice/git-github/first-local-repo.md",
      "estimatedMinutes": 30,
      "tags": ["git", "practice"]
    },
    {
      "id": "git.stage-status",
      "track": "git-github",
      "type": "practice",
      "title": "Stage & Status",
      "level": "practice",
      "status": "pilot",
      "x": 720,
      "y": 120,
      "contentRef": "content/practice/git-github/stage-status.md",
      "estimatedMinutes": 25,
      "tags": ["git", "staging"]
    },
    {
      "id": "git.making-commits",
      "track": "git-github",
      "type": "practice",
      "title": "Making Commits",
      "level": "practice",
      "status": "pilot",
      "x": 1020,
      "y": 120,
      "contentRef": "content/practice/git-github/making-commits.md",
      "estimatedMinutes": 20,
      "tags": ["git", "commit"]
    },
    {
      "id": "git.branching-basics",
      "track": "git-github",
      "type": "topic",
      "title": "Branching Basics",
      "level": "root",
      "status": "pilot",
      "x": 1320,
      "y": 120,
      "contentRef": "content/topics/git-github/branching-basics.md",
      "estimatedMinutes": 35,
      "tags": ["git", "branching"]
    },
    {
      "id": "html.what-html-does",
      "track": "html",
      "type": "topic",
      "title": "What HTML Does",
      "level": "root",
      "status": "pilot",
      "x": 120,
      "y": 320,
      "contentRef": "content/topics/html/what-html-does.md",
      "estimatedMinutes": 20,
      "tags": ["html", "web"]
    },
    {
      "id": "html.profile-card-structure",
      "track": "html",
      "type": "practice",
      "title": "Profile Card Structure",
      "level": "practice",
      "status": "pilot",
      "x": 420,
      "y": 320,
      "contentRef": "content/practice/html/profile-card-structure.md",
      "estimatedMinutes": 35,
      "tags": ["html", "practice"]
    },
    {
      "id": "html.document-structure",
      "track": "html",
      "type": "topic",
      "title": "Document Structure",
      "level": "root",
      "status": "pilot",
      "x": 720,
      "y": 320,
      "contentRef": "content/topics/html/document-structure.md",
      "estimatedMinutes": 25,
      "tags": ["html", "semantics"]
    },
    {
      "id": "html.headings-paragraphs",
      "track": "html",
      "type": "topic",
      "title": "Headings & Paragraphs",
      "level": "root",
      "status": "pilot",
      "x": 1020,
      "y": 320,
      "contentRef": "content/topics/html/headings-paragraphs.md",
      "estimatedMinutes": 20,
      "tags": ["html", "elements"]
    },
    {
      "id": "html.links-images",
      "track": "html",
      "type": "practice",
      "title": "Links & Images",
      "level": "practice",
      "status": "pilot",
      "x": 1320,
      "y": 320,
      "contentRef": "content/practice/html/links-images.md",
      "estimatedMinutes": 30,
      "tags": ["html", "media"]
    }
  ],
  "edges": [
    {
      "from": "git.what-is-git",
      "to": "git.first-local-repo",
      "type": "recommended-next"
    },
    {
      "from": "git.first-local-repo",
      "to": "git.stage-status",
      "type": "recommended-next"
    },
    {
      "from": "git.stage-status",
      "to": "git.making-commits",
      "type": "recommended-next"
    },
    {
      "from": "git.making-commits",
      "to": "git.branching-basics",
      "type": "recommended-next"
    },
    {
      "from": "html.what-html-does",
      "to": "html.profile-card-structure",
      "type": "recommended-next"
    },
    {
      "from": "html.profile-card-structure",
      "to": "html.document-structure",
      "type": "recommended-next"
    },
    {
      "from": "html.document-structure",
      "to": "html.headings-paragraphs",
      "type": "recommended-next"
    },
    {
      "from": "html.headings-paragraphs",
      "to": "html.links-images",
      "type": "recommended-next"
    },
    {
      "from": "git.first-local-repo",
      "to": "html.what-html-does",
      "type": "suggested-before"
    }
  ]
}
